"So disappointed,",0
Low quality item,0
wallet has damage and easily broken. ,0
May damage ung blue ,0
Was disappointed kasi ibang color dumating hindi yung light pink tapos yupi ung sarahan so di siya nasasara. ,0
Sira ang wallet... ðŸ˜ ðŸ˜¡ nakakahiyang ipang-regalo kase sira...,0
nakaka dis appoint kasi yung isa sa mga order ko sira. ,0
TABINGIIIII NAKAKAINIS!!!!!!! ,0
"Dissapointed, halos lahat kumupas ang kulay at yung iba may parang kagat ng daga..huhuhu",0
Mali Yung color na binigay,0
Dissapointed ðŸ˜¡ sira ung tali at maluwag kaasarr!,0
Dissapointed ako sobra!!!,0
Jusko may damage na yung item,0
Damage item,0
Sira ang btton ng items n pindala nyo 😡,0
iba pa ang kulay tssssk ,0
KULANG YUNG DINELIVER SAKIN ðŸ˜ ðŸ˜¡,0
SAYANG LANG BINAYAD KO TAPOS DI NAMAN NAGREREPLY SI SELLER NG MAAYOS ðŸ˜¡ðŸ˜ ,0
NAKAKADISMAYA! 😡😡,0
yung quality hindi maganda,0
ira naman ung pinadala nyo Na Wallet.,0
ndi rin kau nagrereply sa mga message.,0
never Na ko oorder sa shop Na to..,0
Wag na kayo bumili dito Hindi responsive ang seller ,0
may butas yong pinadala sakin at hindi sya nag rereplay sa chat napaka iresponsible na seller to,0
At yong product hindi katulad ng nasa picture kong may 0 rate sana zero irate ko dito.. ,0
DAMAGE! 😡 ,0
Quality not good.,0
Sira ung lock ng item na pinadala.,0
Hindi responsive ang seller kahit ilang beses ako ng message kasi hindi alam paano bubuksan ang wallet.,0
Wrong item received Damaged / Defective item Did not receive item Rude seller Will not order again,0
Walang kwentang seller!!!!,0
Iba yong item ang Binigay!!! ,0
Tanga tangang seller!!!! Wag kayong omorder!!! ,0
its suck its not what it loooks like on the pictures  ??,0
Not that good,0
mali ung binigayna color. ,0
faded pa yung kulay ..mukhang luma..super disappointed ako sa order ko..,0
Kulang isa wallet order ,0
Sira namn yong item ??,0
May sira at durog 🤬,0
not happy i received a damage item then i try to contact the seller but no response coming from there.ðŸ¤¬ðŸ¤¬ðŸ¤¬,0
"color blind yung seller, too irresponsible makabenta lang! not recomended, i ordered black, navy blue pinadala sira pa ðŸ˜ ",0
My damage po ,0
Damaged product ðŸ˜¤ðŸ˜¤ðŸ˜¤ðŸ˜¤ðŸ˜¤ðŸ˜¤ðŸ˜¤ðŸ˜¤ðŸ˜¤ðŸ˜¤ðŸ˜¤ðŸ˜¤ðŸ˜¤ðŸ˜¤ðŸ˜¤ðŸ˜¤ðŸ˜¤ðŸ˜¤ðŸ˜¤ðŸ˜¤ðŸ˜¤ðŸ˜¤ðŸ˜¤ðŸ˜¤ðŸ˜¤ðŸ˜¤ðŸ˜¤ðŸ˜¤ðŸ˜¤ðŸ˜¤ðŸ˜¤ðŸ˜¤ðŸ˜¤ðŸ˜¤ðŸ˜¤ðŸ˜¤ðŸ˜¤ðŸ˜¤ðŸ˜¤ðŸ˜¤ðŸ˜¤ðŸ˜¤ðŸ˜¤ðŸ˜¤ðŸ˜¤ðŸ˜¤ðŸ˜¤ðŸ˜¤ðŸ˜¤ðŸ˜¤ðŸ˜¤ðŸ˜¤ðŸ˜¤ðŸ˜¤,0
Not quality ðŸ¤¦â€â™€ï¸??,0
pangit sa personal,0
"ki pangit ng dumating ,. Anuh ba yan",0
May sira yung wallet🤬,0
One star KC KC may damage,0
SIRA Naman ..ayw not irefund🤬🤬🤬,0
Hindi dumating...hayzt,0
Maam sira po yong item,0
Not satisfied..,0
May scratch po yong wallet ,0
wrong color !!!!,0
Ang bilis masira ,0
Cheap quality,0
Seller is not responsive.,0
Hindi po kumakapit yung lock nya . Nagbubukas po sya agad .,0
Wrong color,0
Unang gamit ko pa lang sira na kaagad.,0
Wrong color,0
Damaged / Defective item,0
medyo mahirap lang isara. ,0
Received Damaged and Dirty Item,0
I'm so disappointed .,0
sira na ung sling.. disappointed,0
Nakakainis lang napaka dali masira ng lock nganga agadðŸ˜ ðŸ˜ ðŸ˜ ,0
Mali Yung binigay niyong kulay.,0
Ung isang item po may damage d maisara ??,0
Panget HAHAHAAH,0
Mali yung color na dumating.ðŸ˜­ðŸ¤¦ðŸ»,0
Panget ung product,0
ï¿½ï¿½ðŸ‘ŽðŸ‘ŽðŸ‘ŽðŸ‘ŽðŸ‘ŽðŸ‘Ž disappointed! Ibibigay talagang may damaged.kitang kita naman sa harap pa.,0
Ano ba naman to may sira,0
Not yet received!!!,0
Hindi sya naglalock mabuti. Iâ€™m disappointed. Can I refund this?Â ,0
Damaged,0
Sira ang dumating sa wallet sa akin Disappointed ,0
Wrong item received Did not receive item,0
No comment ,0
Wrong color.,0
The item is defective ðŸ˜ ðŸ˜ ðŸ˜ ,0
Bad rateÂ ,0
Ang duming nreceive,0
Pangit ng design sayang lang sa pera,0
Ampangit ng quality,0
Sobrang nipis,0
sira yun wallet ,0
the seller is not helpful,0
May gasgas po sya sa gilid,0
Defective! Hindi sya naglolock.Â ,0
Kulang ng dalawang earpick ðŸ˜¡,0
It's hard to open,0
"Manipis, madaling masira",0
Ang nipis ng folder,0
GO TO ANOTHER SELLER NOT HERE!This SELLER is Rude and does not respect BUYERS! ??,0
Damage items ,0
Sira na agad di pa natagal ??,0
Very disappointing.kulang ung item na deliver,0
"hindi ko recieved, wala sa pinadala nila",0
haizt seller not responsive pa.,0
"Products arrived incomplete, di ko na receive tong card holder",0
Wala ung card holder sa nrcvd ko..,0
Luma na ata ito. Super dumi na,0
Sira yung pinadala di manlang chineck kahit mumurahin dapat maayos naman ðŸ˜¥,0
Ngayun ko lng na pansinðŸ˜­ wala pala to huhuhuðŸ˜­ sana seller check mo bago e shipâ€¼ï¸â€¼ï¸â€¼ï¸,0
Sira nman yung dumating sakin. Sana nman na check nyo muna bago na ship out. Sayang lang ang pera.,0
"Not responsive si seller,nkakadisapoint kasi kahit 10pesos lng to ang pinadala ay sobrang dumi parang nanggaling sa putikan",0
Fyi di ko pa po nareceive ung product,0
Damage,0
Hnd maganda mukhang luma na nakakalungkotðŸ˜”ðŸ˜”ðŸ˜” ??,0
did not receive it.,0
Low quality,0
ito lang yung panget ang quality.,0
Sira agad yung clasp niya kasi sobrang nipis ng kinakapitang leather.,0
I don't recommend this kahit maingat kayo sa gamit.,0
Hind kasya ang I. D disspointedðŸ˜’ðŸ˜ž ????,0
Ang pangit ng kulay na binigay mo seller ,0
"Lacking 1item poor quality, seller hnd nag respond sa chat box at mali mga binigay na color doon sa choice color ko",0
Out of all the items that I received. I did not receive the umbrella. Seller was very unresponsive ??,0
Malayong malayo nung nasa picture,0
Very poor quality. Sure na agad masisira agad.,0
Low quality products,0
Kulang delivery hindi responsive ang seller.,0
Item different from picture,0
No good,0
Pangit,0
Will not order again,0
Mali mali kulay binigay nakaka asar i return nyo to nakaka asar yung sellers,0
sira yung zipper. di mapakinabangan,0
Palpak po ang wallet na dineliver nasa baba ang suotan ng card,0
Sira yung zipper ng wallet. Hindi din namin magamit,0
Sayang lang yung pera. ??????,0
Low quality ðŸ¥º,0
ï¿½ï¿½ðŸ˜¡ðŸ˜¡ðŸ˜¡ðŸ˜¡ðŸ˜¡ðŸ˜¡ðŸ˜¡walang hiya .....wag nakayong mag order sa seller nato dahil 8 item ang order ko pero kita niyu 4 item lang ang dumating ..ang binayad ko sakto para sa 8 item .,0
Didnâ€™t get the item lol,0
tagal pa dumating ung order..ðŸ‘ŽðŸ‘ŽðŸ‘Ž,0
walang refund at hindi responsive,0
Sira ung zipperðŸ˜” ????,0
May mga scratch at yupi wallet iba din color towel seller nasunod Hindi buyer,0
"i didn't received this item, sayang..",0
Hindi tama yung binigay,0
damage!!!!!! ????????,0
Kulang ng wallet,0
The items are not clean and sealed. ,0
Unresponsive seller😡😡,0
Kulang ang item na na receive ko.,0
Kulang yung pinadala,0
Wrong color! Tsk,0
Sira po yung zipper ng wallet,0
Wala akong na received,0
Ang pangit naman po ng binigay nyo mali pa mga tahi😡,0
Na disappoint ako ng sobra ????????,0
Ang pangit ng material na ginamit,0
wrong item received,0
Damage,0
Ang panget ng wallet bad quality wrong color pa bwiset sayang pera ko I don't recommend buying this Sana ma refund,0
Pangit naman ! Ang nipis pa,0
Hindi maganda kasi sira yung zipper useless .. ??,0
D ko type yn lang..,0
"very poor not accomodating seller , ",0
Wag po kayo bibili dito,0
ANU TO?? Hindi naman to order ko!!,0
kulang po yung items na pinadala nila . ,0
Sayang lang po yung pera kuh 🤬. ,0
Nag order ako ng wallet pero walang dumatingðŸ‘ºðŸ‘¿ðŸ˜ ðŸ˜¡ðŸ˜¤ baka pwede din na magreply ka!!.,0
Zero ang rating q sa shop na ito.. i'm very disappointed in this shop I order 2 mini wallet pro isa lng ang dumating I ask for refund pro hindi ng rrply sa mga chat q..hanggang ngyon wla pa rin refund dumating.. Kng aq sa inyo wag kayo umorder sa shop na ito..Yan lng ng n rrply sa akin sa mga tanong,0
"Wag na kayong umorder dito na shop, palaging kulang pinapadala nila! NakakabwesiiiitðŸ˜¡ðŸ˜¡ðŸ˜¡ðŸ˜¡ ",0
very disappointed ,0
Basura pinadala ??????,0
Manipis. Wag na wag kayung oorder dito bukod sa unresponsive seller kulang ang items na ibbgay sa inyu. Nkkbwisit!,0
kulang ng payong ang pinadala nilaðŸ˜ ,0
sana inayos nyo yung order kooooo ðŸ˜ ðŸ˜ ðŸ˜¡ðŸ˜¡ðŸ˜¡,0
Wrong color! Tsk😡😡,0
Sira po yung zipper ng wallet ??,0
Wala akong na received,0
Ang pangit naman po ng binigay nyo mali pa mga tahi,0
Order ko brown hindi black..first time ko magoder online ng wallet tas mali pang color!,0
Iba ung design compare sa inorder ko pati kulay iba!,0
Ang pangit ng material na ginamit ??,0
"wrong item received, order ko wallet and 1faceshield dumating dalawang faceshield report nyo sellerâ€¼ï¸â€¼ï¸â€¼ï¸",0
di nagrereply sa inquiries ??,0
Damage ,0
Pangit naman ! Ang nipis pa,0
Hindi maganda kasi sira yung zipper useless 🤬,0
Na disappointed po ako sa kulay...,0
Walang kwenta!!!🤬🤬🤬 Sa picture lang maganda!!!,0
BASURA 😡????????,0
very disapppinted shop....not accommodating their customer properly.,0
Hindi katulad nung sa pics. Hindi pulido ang finish :(( ,0
Tagal mag ship out ni seller.,0
Will not order again.. kausap ko si seller n different color isend pero same color p din binigay nya..,0
Quality is not good I will never oder again! ??,0
damage di maayos yung tahi paling paling,0
Factory detect po ang pinadala ðŸ˜ ,0
"I did not recieve the black wallet ,i pay on it .but i did'nt receive....",0
Ang pangit😡,0
Butas 😡!!!,0
Very disappointed... Sira2x ang zipper ayaw ko na mag.order sayang lang ang pera. Hindi pa nagrereply ang seller ??????,0
Grrrrrrrrr ðŸ˜ˆðŸ˜ˆðŸ˜ˆðŸ˜ˆðŸ˜ˆðŸ˜ˆðŸ˜ˆðŸ˜ˆðŸ˜ˆðŸ˜ˆðŸ˜ˆðŸ˜ˆðŸ˜ˆðŸ˜ˆðŸ˜ˆðŸ˜ˆðŸ˜ˆðŸ˜ˆðŸ˜ˆðŸ˜ˆðŸ˜ˆðŸ‘½ðŸ˜ˆðŸ‘½ðŸ˜ˆðŸ˜ˆðŸ˜ˆðŸ‘½ðŸ‘½ðŸ‘½ðŸ‘½ðŸ‘½ðŸ‘½ðŸ‘½ðŸ‘½ðŸ˜ˆðŸ˜ˆðŸ‘½ðŸ˜ ðŸ˜ ðŸ˜ ðŸ˜ ðŸ˜ ðŸ˜ ðŸ˜ ðŸ˜ ðŸ˜ ðŸ˜ ðŸ˜ ðŸ˜ ðŸ˜ ðŸ˜ ðŸ˜ ðŸ˜ ðŸ˜ ðŸ˜ ðŸ˜ ðŸ˜ ðŸ˜ ðŸ˜ ðŸ˜ ðŸ˜ ðŸ˜ ðŸ˜ ðŸ˜ ðŸ˜ ðŸ˜ ðŸ˜ ðŸ˜ ðŸ˜ ðŸ˜ ðŸ˜¬ðŸ˜¬ðŸ˜¬ðŸ˜¬ðŸ˜¬ðŸ˜©ðŸ˜©ðŸ˜©ðŸ˜©ðŸ˜©ðŸ˜©ðŸ˜©ðŸ˜©ðŸ˜©ðŸ˜ ðŸ˜©ðŸ˜©ðŸ˜ ðŸ˜ ,0
Kulang yung items wala yung wallet ðŸ¤¦â€â™€ï¸,0
Nakakadismaya yung product! Yung isa may dumi dumi tas yung isa naman sira yung zipper!!! Will not order again hayssss,0
WRONG ITEMS RECEIVED.😡😡 TOO MUCH OF A HASSLE TO RETURN THE ITEMS.Â ,0
Nakaka disappointed overall 1 star ??,0
Low quality wallet,0
Di namn dumating order ko nakakainis lng,0
Dissapointed!!!,0
pangit ung pag katihi hindi matibay pinalakad lng.....kya 1 star lng....,0
ang nakaka bwesit... umasa ka pero mali pala... mali ang item. iba sa picture... bwesit na seller.. SCAM.. parang KAPA!!!! poor quality!!! poor quality!!! poor quality!!! poor quality!!! poor quality!!!,0
bad quality item,0
Iba binigay na item !,0
damage ðŸ˜¢ðŸ˜¢ðŸ˜¢ðŸ˜¢ðŸ˜¢ðŸ˜¢ðŸ˜¢ðŸ˜¢ðŸ˜¢ðŸ˜¢ðŸ‘ŽðŸ‘ŽðŸ‘ŽðŸ‘ŽðŸ‘ŽðŸ‘ŽðŸ‘ŽðŸ‘ŽðŸ‘ŽðŸ‘ŽðŸ‘ŽðŸ‘ŽðŸ‘ŽðŸ‘ŽðŸ‘Ž,0
"Mali mali yung binibigay, wag kayo mag order dito.",0
Ibang kulay ang binigay,0
Ang pangit,0
The wallet was dirty.  😡😡😡,0
Parang may amag ung loob ng wallet this is my second time to order to you guys nakaka inis,0
"Hindi maganda ang product madumi,,,na disappoint ",0
panget qualityÂ ,0
Old stuck Yung binigay ng seller.. panget at di n mganda amoy..,0
Ang panget po ng binigay🤬,0
May butas at bakbak,0
Iba yung dumating ðŸ¤¦â€â™‚ï¸,0
Worst shop so far,0
Pangit 😡😡,0
Manipis,0
"MALI ANG NA RECEIVE KONG KULAY. SIRA YUNG NASA LOCK BANDA BAKIT MAY BUTAS? MATIGAS BUKSAN ANG ZIPPER. LOW QUALITY, SIRA NA NGA NUNG DUMATING TAPOS MADALI PANG MASIRA ðŸ‘Ž I AM NOT SATISFIED MATAGAL PA DUMATING",0
I received is totally different from what is posted in yourðŸ˜³shop. the leather material is too thin.,0
Poor delivery service! Iniiwan nalang basta pag bayad na!,0
Wrong color.,0
my order is not complete. missing yung card holder.,0
Hindi maganda ang quality ??,0
Hindi dumating ang product 🙁 :-( hindi rin nagrereply ang seller 🙁:-(,0
Bumili ako ng Christmas theme para maipasabay sana yung kulang na item sa nauna kong inorder naipadala naman yung item na di nila naisama sa package last time kaso itong bagong order ko mali yung laman. Iba ung nasa model na picture sa mismong laman na kurtina ðŸ˜­ mali din yung size na dumating sakin,0
The seller informed me to replace my order with another design with pics. I did not agree such design because i want something that red is the dominant color. I told her to change the design since i'm not in a hurry. She still sent it. How disgusting. I really don't like it.,0
Mali nakaratimg sakin.. Iba ung order bat ganun paki ayos nyo nman po nagbabayad nman ako ng maayos pero malimali ung binigay nyong items.ðŸ˜”ðŸ˜”ðŸ˜”ðŸ˜”ðŸ˜”ðŸ˜”ðŸ˜”ðŸ˜”ðŸ˜”ðŸ˜”ðŸ˜”ðŸ˜”ðŸ˜”ðŸ˜”ðŸ˜”ðŸ˜”ðŸ˜”ðŸ˜”ðŸ˜”ðŸ˜”ðŸ˜”ðŸ˜”ðŸ˜”ðŸ˜”ðŸ˜”ðŸ˜”ðŸ˜”ðŸ˜”ðŸ˜”ðŸ˜”ðŸ˜”ðŸ˜”ðŸ˜”ðŸ˜”ðŸ˜”ðŸ˜”ðŸ˜”ðŸ˜”ðŸ˜”ðŸ˜”ðŸ˜”ðŸ˜”ðŸ˜”ðŸ˜”ðŸ˜”ðŸ˜”ðŸ˜”ðŸ˜”ðŸ˜”ðŸ˜”ðŸ˜”ðŸ˜”ðŸ˜”ðŸ˜”ðŸ˜”ðŸ˜”ðŸ˜”ðŸ˜”ðŸ˜”ðŸ˜”ðŸ˜”ðŸ˜”ðŸ˜”ðŸ˜”ðŸ˜”ðŸ˜”ðŸ˜”ðŸ˜”ðŸ˜”ðŸ˜”ðŸ˜”ðŸ˜”ðŸ˜”ðŸ˜”ðŸ˜”ðŸ˜”ðŸ˜”ðŸ˜”ðŸ˜”ðŸ˜”ðŸ˜”,0
Check muna bago edeliver..........sira ang narecieved ko..........malaking butas ...............i hate..........,0
"Ang pangit nitong item nato😡😡😡!! Kala namin pair,, yon pala isang peraso lng, pano kaya to gamitin ang pangit tingnan!!!",0
Ang nipis.,0
Bat Mali Ang diniliver nyo? Nagbabayad naman Ako ng maayos bat kulay blue e green Yung order ko bakit bitin tapus maliit. Sana e refund nyo to. Tapos ganian pa pagkakatahi...  iba ung nasa picture Hindi sya real fake Pala ayusin nyo naman at pakitignan maigi Ang order ko ayusin nyo.,0
Hi goodpm seller Ang alam ko pong order na size ng curtain ay 140x180. Bakit Ang dinelivet saken 100x210.. haist no choice na recieved ko na Hindi ko naman nakita na ganun pala Ang size.. pero thank you pa rin shopee and sellerðŸ‘âœŒï¸â˜ºï¸â˜ºï¸,0
Hayy.. excited pa naman ako dito. Dahil Blue ang christmas theme natin ngayon. Kupas ang kulay nya.. ung tipong madami ng pinagdaanan sa buhay. Hindi ganto ung ineexpect ko since sa picture kasi is Dark Blue sya na matingkad.. Disappointed ako ng konti ðŸ˜’ðŸ™„ Packaging and delivery are okay though.,0
Honestly I am not happy with the quality oo mura pero maxado siya mapusyaw parang malungkot naman tignan for Christmas curtain.,0
Mali pinadala di malapad at mataas!! 140x180 order ko pero 100x210 binigay!!! IBA PA PINADALA ORDER PA NAMN TO LATE PA NAGSABIðŸ˜¡ðŸ˜¡ðŸ˜¡ðŸ˜¡ðŸ˜¡ðŸ˜¡ðŸ˜¡ðŸ˜¡ðŸ˜¡ðŸ˜¡ðŸ˜¡ðŸ˜¡ðŸ˜¡ðŸ˜¡ðŸ˜¡ðŸ˜¡ðŸ˜¡ðŸ˜¡ðŸ˜¡ðŸ˜¡ðŸ˜¡ðŸ˜¡ðŸ˜¡ðŸ˜¡ðŸ˜¡ðŸ˜¡ðŸ˜¡ðŸ˜¡ðŸ˜¡ðŸ˜¡ðŸ˜¡ðŸ˜¡ðŸ˜¡ðŸ˜¡ðŸ˜¡ðŸ˜¡ðŸ˜¡ðŸ˜¡ðŸ˜¡,0
"Di maganda tela,manipis at mukang kukupas sya agad sa isang labahan. Sabagay mura lng kaya di ako dapat mag expect ng maganda, naakit lng ako sa ibang reviews na maganda daw,un pala hindi maganda pinadala sakin. Maganda lng sa picture. Sayang pera. ",0
"Not so satisfied. . The fabsic is thin. . Design is the same as advertised but the color is very far way behind. . There is no opening at both ends, no choice but i have make an opening so for the rod to go through, and doing so will absolutely ruin the fabric. See attached video. A",0
First was icacancel ko na sana ang order ko because out of stock daw. Un pala pinalitan nila ng iba. Im not sure kung mapagkakatiwalaan ang shop na ito.i,0
"Hindi naman ako nag expect na sobrang ganda ng dadating na curtain kasi alam kong mura lang, pero Sobrang nakakadisappoint kasi yung kulay parang luma na, kupas na. Magkaibang design pa yung dumating, same design ang order ko. Yung isang kurtina, hindi pa maayos pagkatahi.",0
sana man lang nag inform kung out of stock ba yung inorder kong design..haynku,0
"Bagal ng delivery,hnd sumasagot sa txt ang seller ....",0
"ANG PANGIT NGA TELA!! MANIPIS, ANG PRINT PARANG 10 YEARS NA GINAGAMIT.. OK SANA C SELLER PERO UNG PRODUCT SOBRANG PANGIT,, NAHIHIYA AKO NI MAMA KC 1ST TIME NYA MAG ORDER SA SHOPPE, NAKAKMURA NGA PERO ANG QUALITY PANGIT.. SAYANG YUNG PERA NYO PROMISE.ðŸ˜¡ðŸ˜¡ðŸ˜¡",0
"I'm so disappointedðŸ˜¡ðŸ˜¡ðŸ˜¡subrang sinungaling si seller 140x180 nka display na size pro pgdating dto 100x210 tpos ang pangit pa Ng kulay malabnaw at hnd Tama ang color Ng pinili ko subrang nkka dsmaya tlga,nagbbayad ako Ng sakto pro mali2x ibbigay sauðŸ˜¡ðŸ˜¡ðŸ˜¡",0
Naka dismaya bakit yong size hindi nasunod Ang order ko 140x180 bat naging 100x140 be responsible naman seller kasi pano ito hindi nasunod it's means yong omorder Sakin into hindi matutuwa kasi Mali hai hai be responsible na man sa susunod,0
140-180cm nkpost s inyo.. bakit nun naideliver n ang kurtina s akin eto n naging size 100-210cm na .. pkiayos nmn mga inoorder s inyo..,0
Nakuha ko na order ko kaso mali ung nabigay na design at sukat ng green ang prder ko 140cm x180cm and dumating 100x210 cm. Hays,0
Mali ang sukat ng deniliver nyo 140x180 ang size na nakalagay sa order ko pero dumating 100x210 masyadong mahaba need ko pa remedyohan,0
Super pangit ng curtains... Iba ung tela nya sa nabili ko sa ibang shop... Hindi xa red... Pink na ato to ehhh... As in worst curtain na nabili ko online... Pero ok naman ung seller nag uupdate xa,0
I will only give 3 stars this time kc mali mali pong design yong pinadalaðŸ˜¢ðŸ˜¢ðŸ˜¢nakakainis di nman po inayos dapat kung ano po order yon po pinapadala nyo!!!,0
Apat ang punit sa pitong inorder namin. ang ganda pa naman sana.,0
Item received is smaller than what is listed in the product details. Gave the feedback to seller for incorrect spec. Will not be ordering again,0
Not a complete curtain just like what is in the picture. Only one side. Faded color.,0
"Fast shipping pero napaka fade ng color! Kala ko pa nman dark blue talaga sya. Ang putla. Ampangit. Sayang pera. Alam ko nman na cheap price, so what to expect. . Etong pang xmas design na to, ðŸ‘Ž talaga",0
"Kulang po ang pinadala .. 3 sets po order ko, 2 sets lng dumting.. bakit?",0
nakaka disapoint bukod ung tela nya sa parang gamit na gamit na ibang iba sa picture na dark ung pagka black nya kupas na kupas pa... may damage pa apat pa naman knuha koðŸ¤¦â€â™€ï¸ðŸ¤¦â€â™€ï¸ðŸ¤¦â€â™€ï¸,0
"I ordered size140x180, you give me 100x210, a little bit disappointed",0
"Incompete ung unang sinend sakin na item. Pinag order nya ako ng bagong item para daw isesend nya ung kulang, pero ung nareceive ko lang eh ung bagong order lang. Sana nirefund nyo nalang derecho nagsayang lang ako ng pera sa inyo!! Sobrang nipis naman ng kurtina ang panget ng tela 0 star dapat ito",0
Di na kami oorder dito mali yung size na binibigay panget pa ng tela hindi namin mali kami pa magbabayad ng shipping pabalik,0
Grabi Ang ninipis nmn ng bibigay sakin Ung ona na order ko makapal naman un parepariho nmn. Ung price nya tapos. Bakit annipis ng huling bibigay,0
"2 diff designs at price ung inorder q,dumating same design nung mas mura.ang price nung isang binayaran q mas mahal dyan sa pinadala.next time po hintayin nyo nmn reply ng customer bago nyo ipa ship.pano pag d nya nagustuhan design o hindi bagay sa theme ng bahay dba.KAMI NAGBABAYAD KAMI MASUSUNOD!",0
Manipis palaðŸ˜‘,0
ang pangit ng items nyo...ung order kong curtain ay size 140x180...pro ung pinadala nyo is 100x210...ang luma pa...8pcs pnaman order ko...nakakadismaya kayo...,0
Nku po bkt ganito kapangit..kaganda nong una qng inorder kakadismaya pangit...,0
Ang liit at manipis. ðŸ˜¥,0
"Very disappointed. I DO NOT RECOMMEND THIS STORE! IT'S THE 2ND TIME I RECEIVED INCORRECT ITEMS!!! OBVIOUSLY, SELLER DOESN'T CHECK THE ITEMS BEFORE SHIPPED. I received 33 INCORRECT ITEMS in total!!!",0
Matagal yong Shipping . na disappoint talaga ako kasi Ang nipis ng tela.,0
So disappointed! Super nipis parang papel or one time lang pwde gamitin parang disposable .. kupas din po ang kulay ..nakakapanghinayang ..pwde bang ibalik ito??? Sayang lang pera . Maganda lang sa picture .,0
hindi maganda tela nangungupas,0
Matamlay ung print,0
"Mali ang pinadala. 140x180 ang order ko ang pinadal 100x210 , tapos wala pang dobleng tela sa taas. Andami pa naman ng order ko. 24 pcs kasi order sa akin. Ngayon hi di kinuha nung umorder kasi mali ang size!",0
"Kupas ang kulay, hindi maganda.",0
Maling design at kulay pinadala sana naman sa susunod mag update kayo Kung d available yung item d yung magbibigay kayo ng iba yung d pa bet na design at kulay. Ito yata slow moving na design kaya 6pcs. Talaga binigay sakin!,0
"Bkit ibang kulay binigay nyo,. Mali pa ang size nya. Ano bayan.",0
Kaganda sa picture sa personal iba🙁.......,0
faded lng ang kulay nya.... ,0
Mejo faded ung color,0
Nakaka disapoint po mali ang dumating na order Sakin.. at nung kinokontak kupo ung shop nyo para ipalit ung order ko ni isa wlang sagot .. pasensya npo sa comment ko maging aware din po sna kayo sa mga costumer nyo salamat,0
Manipis sya....,0
out of stock u g order ko at hindi ko gusto ang kulay na pinalit... i don't like red!!!!!!!,0
Very disappointed ðŸ˜žðŸ˜” mali ung binigay na color. Red w/ Santa clous ung design. Pero gold dumating.. umoorder ako ulit pero sa iba na. Baka kc iba parin ang ipapadala.. tskkkkk ðŸ™„ðŸ¤¨,0
Expect the unexpected.sobrang panget ng item.Magka iba ang pic sa actual.,0
Ang pangit Yung telA pati Yung kulay,0
Bakit ang domating ay iba hindi yong kolay na order ko,0
Akala ko yung picture na display katulad sa actually na picture. Ang layo pala. Di ko na gustuhan an kulay. Piro thank you parin po.,0
Yung christmas curtain napakaganda nya sa picture sa personal napakapangit yung kulay nya ang pangit yung tela manipis. Kung gaano xia kaganda sa picture ganun din xia kapangit personal akala ko  yung curtain hindi pala expectation vs. reality ika nga ðŸ˜ŒðŸ˜Œ,0
"Ahmm. Yung quality ng pag kaka print ay super blurred ðŸ˜‚ dahil ba sa cheap ang price kaya ganun. Anyway, don't know where to use kasi di sya presentable ðŸ˜‚ðŸ˜‚ðŸ˜‚",0
Not satisfied ðŸ˜¢ðŸ˜¢ðŸ˜¢,0
I give one star po Kasi faded na yung kulay nang kurtina di na halos makita yung design.hays naka disappoint ðŸ¥ºðŸ˜ž,0
"ka disappoint talaga tama Yong binayad ko kulang ang item na pinadala..mali pa ang size ng isa..,ðŸ˜ ðŸ˜ ðŸ˜ ðŸ˜ ",0
140x180 ang nkalagay na sizeðŸ™„peru ang dumating ang liiitðŸ˜”ðŸ˜”ðŸ˜” disappointed agad 1st order palang...hndi n Aq ulit oorderðŸ˜¥,0
Yung order ko mali... 3 yung mali ang dalawa tama.. Nakakadismaya kasi di kinuha yung 3..,0
Bkit diman kulay red naging maroon dumating sken tpos ung isa mhaba pa,0
Hindi na ako oorder ulit dito sa seller nato.di naman sila nasunod sa design at collor..kakainis langðŸ˜”ðŸ˜”ðŸ˜”,0
Ang nipis ng tela...hindi kp nagustohan ,0
180x140 order ko ðŸ˜” peru 200x110 dumating not satisfied costumerðŸ˜,0
Item received is smaller than what is listed in the product details. Gave the feedback to seller for incorrect spec. Will not be ordering again,0
"Parang kupas nman... Pro mahaba nman xa, kasya siya sa pinto namin...",0
Grabe kahit nakaplatinum member na ako sobrang laki triple ang shipping fee nakakainis dati nong mga 15 lang ang shipping fee ngyong naka platinum member na ako mas tumaas pa ang shopping kainis ka Shopee,0
"Not satisfied, ??",0
It gives black variation option pero ibang kulay dumadating. Ipapa-return ni seller kaya hassle pa sa buyer. NOT RECOMMENDED TO BUY HERE ðŸ‘ŽðŸ¼ðŸ‘ŽðŸ¼ðŸ‘ŽðŸ¼,0
"Item different from the picture talaga. Very different. Parang nagamit na at ilang ulit ng sinubsob sa tubig... UkayÂ² na shoes e.. Sana wag nalang magpost ng kay Ganda gandang pictures tas di naman pala sakto pagka deliver na sakin,",0
"Long story, I only ordered 2 items and this one has factory defect, Hindi pareho ang likod, missing ang black sa likuran ng shoes, we talked it with the seller and I got 100 refund and I hope this will not happen again. The red one is OK. Thanks shopee for giving chance to rate this sellers",0
sira namn ung sapatos durog ung pinag tahian,0
"Not d expected from d photo, very far.",0
I ordered the red one but I received a yellow one. ðŸ™‚ Plus the packaging is not good. The seal of the plastic is already torn out.,0
"Isa sa pinkapangit n item n n-recieve ko, madaya ang supplier, iba ang nka-display s promo s ipinapadalang item... Nakakagalit talaga.... Hay naku",0
manipis lang pala sya ,0
Ser bakit yung na delever nyu na sapatos mali yung isa d sila paris lahat puro kaliwa,0
"Size 39 inorder ko pero size 38 ang dumating, sayang lang hindi lang din magagamit ðŸ¤¦â€â™€ï¸",0
Ang sabi COD PRO D NMN HINAHATID SA ADDRESS N NKALAGAY..SAYANG LNG BINABAYAD NMIN NA SHIPPING FEE,0
Kulang kulangðŸ‘ŽðŸ‘ŽðŸ‘ŽðŸ‘ŽðŸ‘ŽðŸ‘Ž,0
